{
  "schemaVersion": "1.0",
  "requestId": "52dd0dc8-dcd2-4131-85ec-c14a9af75e88",
  "traceId": "90c3d1ef-97ee-454d-92ce-5e16609ae170",
  "timestamp": "2026-10-15T00:00:00.000Z",
  "capabilities": [
    {
      "id": "promiseguard",
      "label": "PromiseGuard",
      "description": "Core commerce intelligence module; business implementation not started.",
      "state": "stub",
      "routes": []
    },
    {
      "id": "marginleak",
      "label": "MarginLeak",
      "description": "Secondary module; business implementation not started.",
      "state": "planned",
      "routes": []
    },
    {
      "id": "rescuecart",
      "label": "RescueCart",
      "description": "Optional future module excluded from Mission 002.",
      "state": "disabled",
      "routes": []
    }
  ]
}
